{
  "version": "1.0.0",
  "meta": {
    "name": "Tokens Ref Test",
    "created": "2025-01-01T00:00:00.000Z",
    "modified": "2025-01-01T00:00:00.000Z"
  },
  "tokens": {
    "colors": {
      "blue": { "value": "#3B82F6" },
      "primary": { "value": "{colors.blue}" },
      "brand": { "value": "{colors.primary}" }
    },
    "spacing": {
      "base": { "value": "16px" },
      "double": { "value": "{spacing.base}" }
    },
    "typography": {},
    "borderRadius": {},
    "shadows": {},
    "breakpoints": {}
  },
  "components": {},
  "pages": {
    "page1": {
      "name": "Page 1",
      "width": 1440,
      "height": null,
      "nodes": {
        "root": {
          "type": "frame",
          "name": "Root",
          "layout": { "direction": "column" },
          "children": []
        }
      }
    }
  }
}
